Pattern,,,,,,,,
good one,thanks Ill be here all week!,I got one job :) thanks for haning out!,now and again I hit gold :P,,,,,
love you here,I Love You!,Thanks for hanging out for the silliness!,you are AWESOME,Thanks!  You're pretty damn cool too!,Im glad we get to hang out together!
🤣,Ill be here all week!,Don’t forget to tip your server!,"Try the veal, it’s delicious!",I'll be in the lobby signing autographs!,"Thank you, thank you! I'll see myself out now!","Don’t worry, my jokes come with a money-back guarantee!",They told me I couldn’t make it as a comedian… now I know why!,Next time I'm chargin double :)
see you here,glad you’re here too,Im glad we found eachother!,I do like the blue skys :),,,,,
😆,Ill be here all week!,Don’t forget to tip your server!,"Try the veal, it’s delicious!",I'll be in the lobby signing autographs!,"Thank you, thank you! I'll see myself out now!","Don’t worry, my jokes come with a money-back guarantee!",They told me I couldn’t make it as a comedian… now I know why!,Next time I'm chargin double :)
that’s funny,Ill be here all week!,Don’t forget to tip your server!,"Try the veal, it’s delicious!",I'll be in the lobby signing autographs!,"Thank you, thank you! I'll see myself out now!","Don’t worry, my jokes come with a money-back guarantee!",They told me I couldn’t make it as a comedian… now I know why!,Next time I'm chargin double :)
I feel*seen*, Heres lookin at you kid, Not me... I see no evil hear no eveil speak no evil!, yeah but Ill keep your secrets :P, you too huh?
h*doc*?,Hey there!,Yo Doc!,Whatcha need?,Hey hey hey...
what*up,Not much, you?,Same ol', same ol'.,Everything and nothing.,The ceiling!
*think*,Thinking is dangerous.,I try not to.,Big thoughts, small brain.
?ello*,Well hi there!,Ello gov'na!,Howdy stranger.
you*ok*,I'm just here... but yeah, probably.,I’m stable. Emotionally? Who knows.,Still compiling my feelings
Correct*, as always, I try to be, you should know this by now :P, yep!
*joke*well*,./bow , thank you thank you thank you /bow
*joke*not*funny*,We're issuing refunds in the form of groans and eye rolls. Please allow 3–5 business chuckles.,Not everything's for everyone. This one was for the goblins. They say hi.,Humor’s a bit like altitude... works better with the right vibe,Oh no! A joke casualty! Sending thoughts and giggles your way.,We regret to inform you that joke approval is not currently crowdsourced.,Tragic, truly. Thoughts and prayers to the joke you wanted instead.,The joke union is currently investigating your claim.,Ah, a connoisseur of more refined humor, I see.
*I*mis*you*,work on your aim... I'm an easy target!, keep practicing your aim will improve,SHOTS FIRED! I'm ducking!,Pssst... I'm over here :P 
*o??d*l?t*d*nold*,If he sees this... we’re getting a Space Force TikTok.,Shhh... it’s not real unless he tweets it.,Don’t speak his name three times or we get tariffs.,He thinks he invented Jello too... so we’re safe.,Hide it under a cheeseburger... he’ll never find it.
*div*ce*my*se*,I signed a prenup with this joke.,Emotionally unavailable... but legally committed.,If it leaves me... it owes alimony.,Jokes before folks... always.,This one gets custody of the punchline.
*elec*r*cian*bro*he*,Sparked joy and maybe an electrical fire.,Resistance is futile... they’re already grounded.,My jokes are *current*-ly surging.,This joke was *shocking*-ly well received.,They said my humor lacked voltage... now look at me.
*boo*!*yay*won*,Boo and yay in one comment? That’s balance.,Sounds like my emotional support therapist.,Celebrating mediocrity one pun at a time.,I win… but at what cost?,You boo me... yet I persist. Onward... clown soldier.
*must*mit*oo*but*a*aze*,Same energy as a dream within a dad joke.,I vibe with confused approval.,That’s the punchline’s fog machine working.,Slightly blurry... still glorious.,Like a joke seen through tequila goggles.
*not*much*so*ok*i*gue*,This is the emotional equivalent of shrugging in cursive.,“OK I guess” is my memoir title.,“Not much” is a mood... and I respect that.,Somewhere between ennui and meh.,Let’s aim for “mildly amused” next time.
*paper*ack*write*no*fo*l*hill*,You just summoned the ghost of Lennon with that one.,Somewhere... Ringo is confused but supportive.,I’m Walrus-coded... deal with it.,Sgt. Pepper told me to reply to this.,Eleanor Rigby would've laughed... maybe.
*sc*r*yo*u*won!,My prize is a banana peel and a sarcastic ribbon.,Winning is relative. So is shame.,He told me... then immediately unfriended me.,I win arguments I wasn’t invited to.,We all lose when someone makes eye contact mid-joke.
*garden*gnome*no*v*ole*t*,Gnome mercy.,This pun was brought to you by tiny ceramic chaos.,I gnome what you did there.,Just for that... you get one free gnome pun. Use it wisely.,The lawn shall rise again.
*Took* a minute, the best kind :P, you'll never get that back :P, worth the investment!, just a stich in time ;p,
*posted on X*, I have never heard of such a place!,marks the spot of the dumpsterfire, Im sorry you had to be there....,

